user_id,image_paths,user_claim,claim_object,evidence_standard_met,evidence_standard_met_reason,risk_flags,issue_type,object_part,claim_status,claim_status_justification,supporting_image_ids,valid_image,severity
user_a,images/test/demo_001/img_1.jpg;images/test/demo_001/img_2.jpg;images/test/demo_001/img_3.jpg,"Customer: There is a crack in my front windshield from a rock on the highway | Support: Is it the main windshield? | Customer: Yes, right in front of me",car,True,Visual inspection of provided images,none,crack,windshield,needs_review,Assessment based on images and claim conversation,img_1.jpg;img_2.jpg;img_3.jpg,True,moderate
user_b,none,"Customer: Water is leaking into my car when it rains | Support: From the roof area? | Customer: Yes, near the center",car,False,No images provided,none,none,none,rejected,No images available for assessment,none,False,none
user_a,images/test/demo_003/img_1.jpg,"Customer: My rear bumper got dented again in a parking lot | Support: Same spot as before? | Customer: Yes, rear passenger side",car,True,Visual inspection of provided images,none,dent,bumper,needs_review,Assessment based on images and claim conversation,img_1.jpg,True,minor
user_c,images/test/demo_004/img_1.jpg;images/test/demo_004/img_2.jpg,Customer: The passenger side window won't roll up | Support: Electric or manual? | Customer: Electric,car,True,Visual inspection of provided images,none,electrical_failure,window,needs_review,Assessment based on images and claim conversation,img_1.jpg;img_2.jpg,True,minor
user_b,images/test/demo_005/img_1.jpg;images/test/demo_005/img_2.jpg,Customer: Stone chip on the glass but it's tiny | Support: Windshield? | Customer: Yes front windshield,car,True,Visual inspection of provided images,none,scratch,windshield,needs_review,Assessment based on images and claim conversation,img_1.jpg;img_2.jpg,True,minor
